### ISSUE TITLE
Dell SonicWALL port randomization breaks IPv6 PMTUD

### ISSUE THREAD

**Issue by univerio** [falling-sky/source#141]
The MTU test fails on Linux even when the network is configured correctly. After much investigation, I found that Linux (or Ubuntu, anyway), by default, doesn't appear to retry packets with a lower MTU when it receives a Packet Too Big message. The solution is to set `tcp_mtu_probing=1` in the ipv4 (!) kernel options:

    echo 1 | sudo tee /proc/sys/net/ipv4/tcp_mtu_probing

This would be useful in the FAQs for the MTU test.

**Comment by jfesler** [comment]
This fixed your MTU problem?

The best part is, you modified the IPv4 MTU.  I'm probing for IPv6.

**Comment by univerio** [comment]
Yup. Exactly, I was confused too. [This article](https://mellowd.co.uk/ccie/?tag=rfc4821) says the same.

**Comment by jfesler** [comment]
Also, I run ubuntu - and don't run into this problem.

Perhaps you're filtering ICMPv6?  In particular type 2 packets (Packet Too Big)?  If not the linux host, then whatever acts as your upstream firewall.

**Comment by univerio** [comment]
No, I ran tcpdump. ICMPv6 packets arrive perfectly fine. Here is the output:

```
tcpdump: verbose output suppressed, use -v or -vv for full protocol decode
listening on eth1, link-type EN10MB (Ethernet), capture size 262144 bytes
18:08:46.470145 IP6 2607:f598:b129:e600:fd1b:3cce:9223:4d22.59042 > mtu1280.master.test-ipv6.com.http: Flags [S], seq 3809955311, win 28800, options [mss 1440,sackOK,TS val 1100740669 ecr 0,nop,wscale 7], length 0
18:08:46.477811 IP6 mtu1280.master.test-ipv6.com.http > 2607:f598:b129:e600:fd1b:3cce:9223:4d22.59042: Flags [S.], seq 1003386353, ack 3809955312, win 28560, options [mss 1440,sackOK,TS val 147844683 ecr 1100740669,nop,wscale 7], length 0
18:08:46.477838 IP6 2607:f598:b129:e600:fd1b:3cce:9223:4d22.59042 > mtu1280.master.test-ipv6.com.http: Flags [.], ack 1, win 225, options [nop,nop,TS val 1100740671 ecr 147844683], length 0
18:08:46.477877 IP6 2607:f598:b129:e600:fd1b:3cce:9223:4d22.59042 > mtu1280.master.test-ipv6.com.http: Flags [P.], seq 1:1381, ack 1, win 225, options [nop,nop,TS val 1100740671 ecr 147844683], length 1380: HTTP: GET /ip/?size=1600&amp;fill=xxxxxxxxxxxxxxxxxxxxxxxxxxxxxxxxxxxxxxxxxxxxxxxxxxxxxxxxxxxxxxxxxxxxxxxxxxxxxxxxxxxxxxxxxxxxxxxxxxxxxxxxxxxxxxxxxxxxxxxxxxxxxxxxxxxxxxxxxxxxxxxxxxxxxxxxxxxxxxxxxxxxxxxxxxxxxxxxxxxxxxxxxxxxxxxxxxxxxxxxxxxxxxxxxxxxxxxxxxxxxxxxxxxxxxxxxxxxxxxxxxxxxxxxxxxxxxxxxxxxxxxxxxxxxxxxxxxxxxxxxxxxxxxxxxxxxxxxxxxxxxxxxxxxxxxxxxxxxxxxxxxxxxxxxxxxxxxxxxxxxxxxxxxxxxxxxxxxxxxxxxxxxxxxxxxxxxxxxxxxxxxxxxxxxxxxxxxxxxxxxxxxxxxxxxxxxxxxxxxxxxxxxxxxxxxxxxxxxxxxxxxxxxxxxxxxxxxxxxxxxxxxxxxxxxxxxxxxxxxxxxxxxxxxxxxxxxxxxxxxxxxxxxxxxxxxxxxxxxxxxxxxxxxxxxxxxxxxxxxxxxxxxxxxxxxxxxxxxxxxxxxxxxxxxxxxxxxxxxxxxxxxxxxxxxxxxxxxxxxxxxxxxxxxxxxxxxxxxxxxxxxxxxxxxxxxxxxxxxxxxxxxxxxxxxxxxxxxxxxxxxxxxxxxxxxxxxxxxxxxxxxxxxxxxxxxxxxxxxxxxxxxxxxxxxxxxxxxxxxxxxxxxxxxxxxxxxxxxxxxxxxxxxxxxxxxxxxxxxxxxxxxxxxxxxxxxxxxxxxxxxxxxxxxxxxxxxxxxxxxxxxxxxxxxxxxxxxxxxxxxxxxxxxxxxxxxxxxxxxxxxxxxxxxxxxxxxxxxxxxxxxxxxxxxxxxxxxxxxxxxxxxxxxxxxxxxxxxxxxxxxxxxxxxxxxxxxxxxxxxxxxxxxxxxxxxxxxxxxxxxxxxxxxxxxxxxxxxxxxxxxxxxxxxxxxxxxxxxxxxxxxxxxxxxxxxxxxxxxxxxxxxxxxxxxxxxxxxxxxxxxxxxxxxxxxxxxxxxxxxxxxxxxxxxxxxxxxxxxxxxxxxxxxxxxxxxxxxxxxxxxxxxxxxxxxxxxxxxxxxxxxxxxxxxxxxxxxxxxxxxxxxxxxxxxxxxxxxxxxxxxxxxxxxxxxxxxxxxxxxxxxxxxxxxxxxxxxxxxxxxxxxxxxxxxxxxxxxxxxxxxxxxxxxxxxxxxxxxxxxxxxxxxxxxxxxxxxxxxxxxxxxxxxxxxxxxxxxxxxxxxxxxxxxxxxx HTTP/1.1
18:08:46.484898 IP6 mtu1280.master.test-ipv6.com > 2607:f598:b129:e600:fd1b:3cce:9223:4d22: ICMP6, packet too big, mtu 1280, length 1240
18:08:46.684216 IP6 2607:f598:b129:e600:fd1b:3cce:9223:4d22.59042 > mtu1280.master.test-ipv6.com.http: Flags [P.], seq 1:1381, ack 1, win 225, options [nop,nop,TS val 1100740723 ecr 147844683], length 1380: HTTP: GET /ip/?size=1600&amp;fill=xxxxxxxxxxxxxxxxxxxxxxxxxxxxxxxxxxxxxxxxxxxxxxxxxxxxxxxxxxxxxxxxxxxxxxxxxxxxxxxxxxxxxxxxxxxxxxxxxxxxxxxxxxxxxxxxxxxxxxxxxxxxxxxxxxxxxxxxxxxxxxxxxxxxxxxxxxxxxxxxxxxxxxxxxxxxxxxxxxxxxxxxxxxxxxxxxxxxxxxxxxxxxxxxxxxxxxxxxxxxxxxxxxxxxxxxxxxxxxxxxxxxxxxxxxxxxxxxxxxxxxxxxxxxxxxxxxxxxxxxxxxxxxxxxxxxxxxxxxxxxxxxxxxxxxxxxxxxxxxxxxxxxxxxxxxxxxxxxxxxxxxxxxxxxxxxxxxxxxxxxxxxxxxxxxxxxxxxxxxxxxxxxxxxxxxxxxxxxxxxxxxxxxxxxxxxxxxxxxxxxxxxxxxxxxxxxxxxxxxxxxxxxxxxxxxxxxxxxxxxxxxxxxxxxxxxxxxxxxxxxxxxxxxxxxxxxxxxxxxxxxxxxxxxxxxxxxxxxxxxxxxxxxxxxxxxxxxxxxxxxxxxxxxxxxxxxxxxxxxxxxxxxxxxxxxxxxxxxxxxxxxxxxxxxxxxxxxxxxxxxxxxxxxxxxxxxxxxxxxxxxxxxxxxxxxxxxxxxxxxxxxxxxxxxxxxxxxxxxxxxxxxxxxxxxxxxxxxxxxxxxxxxxxxxxxxxxxxxxxxxxxxxxxxxxxxxxxxxxxxxxxxxxxxxxxxxxxxxxxxxxxxxxxxxxxxxxxxxxxxxxxxxxxxxxxxxxxxxxxxxxxxxxxxxxxxxxxxxxxxxxxxxxxxxxxxxxxxxxxxxxxxxxxxxxxxxxxxxxxxxxxxxxxxxxxxxxxxxxxxxxxxxxxxxxxxxxxxxxxxxxxxxxxxxxxxxxxxxxxxxxxxxxxxxxxxxxxxxxxxxxxxxxxxxxxxxxxxxxxxxxxxxxxxxxxxxxxxxxxxxxxxxxxxxxxxxxxxxxxxxxxxxxxxxxxxxxxxxxxxxxxxxxxxxxxxxxxxxxxxxxxxxxxxxxxxxxxxxxxxxxxxxxxxxxxxxxxxxxxxxxxxxxxxxxxxxxxxxxxxxxxxxxxxxxxxxxxxxxxxxxxxxxxxxxxxxxxxxxxxxxxxxxxxxxxxxxxxxxxxxxxxxxxxxxxxxxxxxxxxxxxxxxxxxxxxxxxxxxxxxxxxxxxxxxxxxxxxxxxxxxxxxxxxxxxxxxxxxxxxxxxxxxxxxxxxxxxxxxxxxxxxxxxxxxxxxxxxxxxxxxxxxxxxxxxx HTTP/1.1
18:08:46.691293 IP6 mtu1280.master.test-ipv6.com > 2607:f598:b129:e600:fd1b:3cce:9223:4d22: ICMP6, packet too big, mtu 1280, length 1240
18:08:46.892213 IP6 2607:f598:b129:e600:fd1b:3cce:9223:4d22.59042 > mtu1280.master.test-ipv6.com.http: Flags [P.], seq 1:1381, ack 1, win 225, options [nop,nop,TS val 1100740775 ecr 147844683], length 1380: HTTP: GET /ip/?size=1600&amp;fill=xxxxxxxxxxxxxxxxxxxxxxxxxxxxxxxxxxxxxxxxxxxxxxxxxxxxxxxxxxxxxxxxxxxxxxxxxxxxxxxxxxxxxxxxxxxxxxxxxxxxxxxxxxxxxxxxxxxxxxxxxxxxxxxxxxxxxxxxxxxxxxxxxxxxxxxxxxxxxxxxxxxxxxxxxxxxxxxxxxxxxxxxxxxxxxxxxxxxxxxxxxxxxxxxxxxxxxxxxxxxxxxxxxxxxxxxxxxxxxxxxxxxxxxxxxxxxxxxxxxxxxxxxxxxxxxxxxxxxxxxxxxxxxxxxxxxxxxxxxxxxxxxxxxxxxxxxxxxxxxxxxxxxxxxxxxxxxxxxxxxxxxxxxxxxxxxxxxxxxxxxxxxxxxxxxxxxxxxxxxxxxxxxxxxxxxxxxxxxxxxxxxxxxxxxxxxxxxxxxxxxxxxxxxxxxxxxxxxxxxxxxxxxxxxxxxxxxxxxxxxxxxxxxxxxxxxxxxxxxxxxxxxxxxxxxxxxxxxxxxxxxxxxxxxxxxxxxxxxxxxxxxxxxxxxxxxxxxxxxxxxxxxxxxxxxxxxxxxxxxxxxxxxxxxxxxxxxxxxxxxxxxxxxxxxxxxxxxxxxxxxxxxxxxxxxxxxxxxxxxxxxxxxxxxxxxxxxxxxxxxxxxxxxxxxxxxxxxxxxxxxxxxxxxxxxxxxxxxxxxxxxxxxxxxxxxxxxxxxxxxxxxxxxxxxxxxxxxxxxxxxxxxxxxxxxxxxxxxxxxxxxxxxxxxxxxxxxxxxxxxxxxxxxxxxxxxxxxxxxxxxxxxxxxxxxxxxxxxxxxxxxxxxxxxxxxxxxxxxxxxxxxxxxxxxxxxxxxxxxxxxxxxxxxxxxxxxxxxxxxxxxxxxxxxxxxxxxxxxxxxxxxxxxxxxxxxxxxxxxxxxxxxxxxxxxxxxxxxxxxxxxxxxxxxxxxxxxxxxxxxxxxxxxxxxxxxxxxxxxxxxxxxxxxxxxxxxxxxxxxxxxxxxxxxxxxxxxxxxxxxxxxxxxxxxxxxxxxxxxxxxxxxxxxxxxxxxxxxxxxxxxxxxxxxxxxxxxxxxxxxxxxxxxxxxxxxxxxxxxxxxxxxxxxxxxxxxxxxxxxxxxxxxxxxxxxxxxxxxxxxxxxxxxxxxxxxxxxxxxxxxxxxxxxxxxxxxxxxxxxxxxxxxxxxxxxxxxxxxxxxxxxxxxxxxxxxxxxxxxxxxxxxxxxxxxxxxxxxxxxxxxxxxxxxxxxxxxxxxxxxxxxxxxxxxxxxxxxxxxxxxxxxxxxxxxxx HTTP/1.1
18:08:46.899383 IP6 mtu1280.master.test-ipv6.com > 2607:f598:b129:e600:fd1b:3cce:9223:4d22: ICMP6, packet too big, mtu 1280, length 1240
18:08:47.308199 IP6 2607:f598:b129:e600:fd1b:3cce:9223:4d22.59042 > mtu1280.master.test-ipv6.com.http: Flags [P.], seq 1:1381, ack 1, win 225, options [nop,nop,TS val 1100740879 ecr 147844683], length 1380: HTTP: GET /ip/?size=1600&amp;fill=xxxxxxxxxxxxxxxxxxxxxxxxxxxxxxxxxxxxxxxxxxxxxxxxxxxxxxxxxxxxxxxxxxxxxxxxxxxxxxxxxxxxxxxxxxxxxxxxxxxxxxxxxxxxxxxxxxxxxxxxxxxxxxxxxxxxxxxxxxxxxxxxxxxxxxxxxxxxxxxxxxxxxxxxxxxxxxxxxxxxxxxxxxxxxxxxxxxxxxxxxxxxxxxxxxxxxxxxxxxxxxxxxxxxxxxxxxxxxxxxxxxxxxxxxxxxxxxxxxxxxxxxxxxxxxxxxxxxxxxxxxxxxxxxxxxxxxxxxxxxxxxxxxxxxxxxxxxxxxxxxxxxxxxxxxxxxxxxxxxxxxxxxxxxxxxxxxxxxxxxxxxxxxxxxxxxxxxxxxxxxxxxxxxxxxxxxxxxxxxxxxxxxxxxxxxxxxxxxxxxxxxxxxxxxxxxxxxxxxxxxxxxxxxxxxxxxxxxxxxxxxxxxxxxxxxxxxxxxxxxxxxxxxxxxxxxxxxxxxxxxxxxxxxxxxxxxxxxxxxxxxxxxxxxxxxxxxxxxxxxxxxxxxxxxxxxxxxxxxxxxxxxxxxxxxxxxxxxxxxxxxxxxxxxxxxxxxxxxxxxxxxxxxxxxxxxxxxxxxxxxxxxxxxxxxxxxxxxxxxxxxxxxxxxxxxxxxxxxxxxxxxxxxxxxxxxxxxxxxxxxxxxxxxxxxxxxxxxxxxxxxxxxxxxxxxxxxxxxxxxxxxxxxxxxxxxxxxxxxxxxxxxxxxxxxxxxxxxxxxxxxxxxxxxxxxxxxxxxxxxxxxxxxxxxxxxxxxxxxxxxxxxxxxxxxxxxxxxxxxxxxxxxxxxxxxxxxxxxxxxxxxxxxxxxxxxxxxxxxxxxxxxxxxxxxxxxxxxxxxxxxxxxxxxxxxxxxxxxxxxxxxxxxxxxxxxxxxxxxxxxxxxxxxxxxxxxxxxxxxxxxxxxxxxxxxxxxxxxxxxxxxxxxxxxxxxxxxxxxxxxxxxxxxxxxxxxxxxxxxxxxxxxxxxxxxxxxxxxxxxxxxxxxxxxxxxxxxxxxxxxxxxxxxxxxxxxxxxxxxxxxxxxxxxxxxxxxxxxxxxxxxxxxxxxxxxxxxxxxxxxxxxxxxxxxxxxxxxxxxxxxxxxxxxxxxxxxxxxxxxxxxxxxxxxxxxxxxxxxxxxxxxxxxxxxxxxxxxxxxxxxxxxxxxxxxxxxxxxxxxxxxxxxxxxxxxxxxxxxxxxxxxxxxxxxxxxxxxxxxxxxxxxxxxxxxxxxxxxxxxxxxxxxxxxxxx HTTP/1.1
18:08:47.315530 IP6 mtu1280.master.test-ipv6.com > 2607:f598:b129:e600:fd1b:3cce:9223:4d22: ICMP6, packet too big, mtu 1280, length 1240
18:08:48.140222 IP6 2607:f598:b129:e600:fd1b:3cce:9223:4d22.59042 > mtu1280.master.test-ipv6.com.http: Flags [P.], seq 1:1381, ack 1, win 225, options [nop,nop,TS val 1100741087 ecr 147844683], length 1380: HTTP: GET /ip/?size=1600&amp;fill=xxxxxxxxxxxxxxxxxxxxxxxxxxxxxxxxxxxxxxxxxxxxxxxxxxxxxxxxxxxxxxxxxxxxxxxxxxxxxxxxxxxxxxxxxxxxxxxxxxxxxxxxxxxxxxxxxxxxxxxxxxxxxxxxxxxxxxxxxxxxxxxxxxxxxxxxxxxxxxxxxxxxxxxxxxxxxxxxxxxxxxxxxxxxxxxxxxxxxxxxxxxxxxxxxxxxxxxxxxxxxxxxxxxxxxxxxxxxxxxxxxxxxxxxxxxxxxxxxxxxxxxxxxxxxxxxxxxxxxxxxxxxxxxxxxxxxxxxxxxxxxxxxxxxxxxxxxxxxxxxxxxxxxxxxxxxxxxxxxxxxxxxxxxxxxxxxxxxxxxxxxxxxxxxxxxxxxxxxxxxxxxxxxxxxxxxxxxxxxxxxxxxxxxxxxxxxxxxxxxxxxxxxxxxxxxxxxxxxxxxxxxxxxxxxxxxxxxxxxxxxxxxxxxxxxxxxxxxxxxxxxxxxxxxxxxxxxxxxxxxxxxxxxxxxxxxxxxxxxxxxxxxxxxxxxxxxxxxxxxxxxxxxxxxxxxxxxxxxxxxxxxxxxxxxxxxxxxxxxxxxxxxxxxxxxxxxxxxxxxxxxxxxxxxxxxxxxxxxxxxxxxxxxxxxxxxxxxxxxxxxxxxxxxxxxxxxxxxxxxxxxxxxxxxxxxxxxxxxxxxxxxxxxxxxxxxxxxxxxxxxxxxxxxxxxxxxxxxxxxxxxxxxxxxxxxxxxxxxxxxxxxxxxxxxxxxxxxxxxxxxxxxxxxxxxxxxxxxxxxxxxxxxxxxxxxxxxxxxxxxxxxxxxxxxxxxxxxxxxxxxxxxxxxxxxxxxxxxxxxxxxxxxxxxxxxxxxxxxxxxxxxxxxxxxxxxxxxxxxxxxxxxxxxxxxxxxxxxxxxxxxxxxxxxxxxxxxxxxxxxxxxxxxxxxxxxxxxxxxxxxxxxxxxxxxxxxxxxxxxxxxxxxxxxxxxxxxxxxxxxxxxxxxxxxxxxxxxxxxxxxxxxxxxxxxxxxxxxxxxxxxxxxxxxxxxxxxxxxxxxxxxxxxxxxxxxxxxxxxxxxxxxxxxxxxxxxxxxxxxxxxxxxxxxxxxxxxxxxxxxxxxxxxxxxxxxxxxxxxxxxxxxxxxxxxxxxxxxxxxxxxxxxxxxxxxxxxxxxxxxxxxxxxxxxxxxxxxxxxxxxxxxxxxxxxxxxxxxxxxxxxxxxxxxxxxxxxxxxxxxxxxxxxxxxxxxxxxxxxxxxxxxxxxxxxxxxxxxxxxxxxxxxxxxxxxx HTTP/1.1
18:08:48.147379 IP6 mtu1280.master.test-ipv6.com > 2607:f598:b129:e600:fd1b:3cce:9223:4d22: ICMP6, packet too big, mtu 1280, length 1240
18:08:49.808202 IP6 2607:f598:b129:e600:fd1b:3cce:9223:4d22.59042 > mtu1280.master.test-ipv6.com.http: Flags [P.], seq 1:1381, ack 1, win 225, options [nop,nop,TS val 1100741504 ecr 147844683], length 1380: HTTP: GET /ip/?size=1600&amp;fill=xxxxxxxxxxxxxxxxxxxxxxxxxxxxxxxxxxxxxxxxxxxxxxxxxxxxxxxxxxxxxxxxxxxxxxxxxxxxxxxxxxxxxxxxxxxxxxxxxxxxxxxxxxxxxxxxxxxxxxxxxxxxxxxxxxxxxxxxxxxxxxxxxxxxxxxxxxxxxxxxxxxxxxxxxxxxxxxxxxxxxxxxxxxxxxxxxxxxxxxxxxxxxxxxxxxxxxxxxxxxxxxxxxxxxxxxxxxxxxxxxxxxxxxxxxxxxxxxxxxxxxxxxxxxxxxxxxxxxxxxxxxxxxxxxxxxxxxxxxxxxxxxxxxxxxxxxxxxxxxxxxxxxxxxxxxxxxxxxxxxxxxxxxxxxxxxxxxxxxxxxxxxxxxxxxxxxxxxxxxxxxxxxxxxxxxxxxxxxxxxxxxxxxxxxxxxxxxxxxxxxxxxxxxxxxxxxxxxxxxxxxxxxxxxxxxxxxxxxxxxxxxxxxxxxxxxxxxxxxxxxxxxxxxxxxxxxxxxxxxxxxxxxxxxxxxxxxxxxxxxxxxxxxxxxxxxxxxxxxxxxxxxxxxxxxxxxxxxxxxxxxxxxxxxxxxxxxxxxxxxxxxxxxxxxxxxxxxxxxxxxxxxxxxxxxxxxxxxxxxxxxxxxxxxxxxxxxxxxxxxxxxxxxxxxxxxxxxxxxxxxxxxxxxxxxxxxxxxxxxxxxxxxxxxxxxxxxxxxxxxxxxxxxxxxxxxxxxxxxxxxxxxxxxxxxxxxxxxxxxxxxxxxxxxxxxxxxxxxxxxxxxxxxxxxxxxxxxxxxxxxxxxxxxxxxxxxxxxxxxxxxxxxxxxxxxxxxxxxxxxxxxxxxxxxxxxxxxxxxxxxxxxxxxxxxxxxxxxxxxxxxxxxxxxxxxxxxxxxxxxxxxxxxxxxxxxxxxxxxxxxxxxxxxxxxxxxxxxxxxxxxxxxxxxxxxxxxxxxxxxxxxxxxxxxxxxxxxxxxxxxxxxxxxxxxxxxxxxxxxxxxxxxxxxxxxxxxxxxxxxxxxxxxxxxxxxxxxxxxxxxxxxxxxxxxxxxxxxxxxxxxxxxxxxxxxxxxxxxxxxxxxxxxxxxxxxxxxxxxxxxxxxxxxxxxxxxxxxxxxxxxxxxxxxxxxxxxxxxxxxxxxxxxxxxxxxxxxxxxxxxxxxxxxxxxxxxxxxxxxxxxxxxxxxxxxxxxxxxxxxxxxxxxxxxxxxxxxxxxxxxxxxxxxxxxxxxxxxxxxxxxxxxxxxxxxxxxxxxxxxxxxxxxxxxxxxxxxxxxxxxxxxxxxxxxxx HTTP/1.1
18:08:49.814771 IP6 mtu1280.master.test-ipv6.com > 2607:f598:b129:e600:fd1b:3cce:9223:4d22: ICMP6, packet too big, mtu 1280, length 1240
18:08:51.792211 IP6 2607:f598:b129:e600:fd1b:3cce:9223:4d22.54560 > mtu1280.master.test-ipv6.com.http: Flags [P.], seq 1920980222:1920981602, ack 683913534, win 225, options [nop,nop,TS val 1100742000 ecr 147843485], length 1380: HTTP: GET /ip/?size=1600&amp;fill=xxxxxxxxxxxxxxxxxxxxxxxxxxxxxxxxxxxxxxxxxxxxxxxxxxxxxxxxxxxxxxxxxxxxxxxxxxxxxxxxxxxxxxxxxxxxxxxxxxxxxxxxxxxxxxxxxxxxxxxxxxxxxxxxxxxxxxxxxxxxxxxxxxxxxxxxxxxxxxxxxxxxxxxxxxxxxxxxxxxxxxxxxxxxxxxxxxxxxxxxxxxxxxxxxxxxxxxxxxxxxxxxxxxxxxxxxxxxxxxxxxxxxxxxxxxxxxxxxxxxxxxxxxxxxxxxxxxxxxxxxxxxxxxxxxxxxxxxxxxxxxxxxxxxxxxxxxxxxxxxxxxxxxxxxxxxxxxxxxxxxxxxxxxxxxxxxxxxxxxxxxxxxxxxxxxxxxxxxxxxxxxxxxxxxxxxxxxxxxxxxxxxxxxxxxxxxxxxxxxxxxxxxxxxxxxxxxxxxxxxxxxxxxxxxxxxxxxxxxxxxxxxxxxxxxxxxxxxxxxxxxxxxxxxxxxxxxxxxxxxxxxxxxxxxxxxxxxxxxxxxxxxxxxxxxxxxxxxxxxxxxxxxxxxxxxxxxxxxxxxxxxxxxxxxxxxxxxxxxxxxxxxxxxxxxxxxxxxxxxxxxxxxxxxxxxxxxxxxxxxxxxxxxxxxxxxxxxxxxxxxxxxxxxxxxxxxxxxxxxxxxxxxxxxxxxxxxxxxxxxxxxxxxxxxxxxxxxxxxxxxxxxxxxxxxxxxxxxxxxxxxxxxxxxxxxxxxxxxxxxxxxxxxxxxxxxxxxxxxxxxxxxxxxxxxxxxxxxxxxxxxxxxxxxxxxxxxxxxxxxxxxxxxxxxxxxxxxxxxxxxxxxxxxxxxxxxxxxxxxxxxxxxxxxxxxxxxxxxxxxxxxxxxxxxxxxxxxxxxxxxxxxxxxxxxxxxxxxxxxxxxxxxxxxxxxxxxxxxxxxxxxxxxxxxxxxxxxxxxxxxxxxxxxxxxxxxxxxxxxxxxxxxxxxxxxxxxxxxxxxxxxxxxxxxxxxxxxxxxxxxxxxxxxxxxxxxxxxxxxxxxxxxxxxxxxxxxxxxxxxxxxxxxxxxxxxxxxxxxxxxxxxxxxxxxxxxxxxxxxxxxxxxxxxxxxxxxxxxxxxxxxxxxxxxxxxxxxxxxxxxxxxxxxxxxxxxxxxxxxxxxxxxxxxxxxxxxxxxxxxxxxxxxxxxxxxxxxxxxxxxxxxxxxxxxxxxxxxxxxxxxxxxxxxxxxxxxxxxxxxxxxxxxxxxxxxxxxxxxxxxxxxxxxxxxxxxxxxxxxxxxxxxxxxxxxx HTTP/1.1
18:08:51.799063 IP6 mtu1280.master.test-ipv6.com > 2607:f598:b129:e600:fd1b:3cce:9223:4d22: ICMP6, packet too big, mtu 1280, length 1240
18:08:53.144205 IP6 2607:f598:b129:e600:fd1b:3cce:9223:4d22.59042 > mtu1280.master.test-ipv6.com.http: Flags [P.], seq 1:1381, ack 1, win 225, options [nop,nop,TS val 1100742338 ecr 147844683], length 1380: HTTP: GET /ip/?size=1600&amp;fill=xxxxxxxxxxxxxxxxxxxxxxxxxxxxxxxxxxxxxxxxxxxxxxxxxxxxxxxxxxxxxxxxxxxxxxxxxxxxxxxxxxxxxxxxxxxxxxxxxxxxxxxxxxxxxxxxxxxxxxxxxxxxxxxxxxxxxxxxxxxxxxxxxxxxxxxxxxxxxxxxxxxxxxxxxxxxxxxxxxxxxxxxxxxxxxxxxxxxxxxxxxxxxxxxxxxxxxxxxxxxxxxxxxxxxxxxxxxxxxxxxxxxxxxxxxxxxxxxxxxxxxxxxxxxxxxxxxxxxxxxxxxxxxxxxxxxxxxxxxxxxxxxxxxxxxxxxxxxxxxxxxxxxxxxxxxxxxxxxxxxxxxxxxxxxxxxxxxxxxxxxxxxxxxxxxxxxxxxxxxxxxxxxxxxxxxxxxxxxxxxxxxxxxxxxxxxxxxxxxxxxxxxxxxxxxxxxxxxxxxxxxxxxxxxxxxxxxxxxxxxxxxxxxxxxxxxxxxxxxxxxxxxxxxxxxxxxxxxxxxxxxxxxxxxxxxxxxxxxxxxxxxxxxxxxxxxxxxxxxxxxxxxxxxxxxxxxxxxxxxxxxxxxxxxxxxxxxxxxxxxxxxxxxxxxxxxxxxxxxxxxxxxxxxxxxxxxxxxxxxxxxxxxxxxxxxxxxxxxxxxxxxxxxxxxxxxxxxxxxxxxxxxxxxxxxxxxxxxxxxxxxxxxxxxxxxxxxxxxxxxxxxxxxxxxxxxxxxxxxxxxxxxxxxxxxxxxxxxxxxxxxxxxxxxxxxxxxxxxxxxxxxxxxxxxxxxxxxxxxxxxxxxxxxxxxxxxxxxxxxxxxxxxxxxxxxxxxxxxxxxxxxxxxxxxxxxxxxxxxxxxxxxxxxxxxxxxxxxxxxxxxxxxxxxxxxxxxxxxxxxxxxxxxxxxxxxxxxxxxxxxxxxxxxxxxxxxxxxxxxxxxxxxxxxxxxxxxxxxxxxxxxxxxxxxxxxxxxxxxxxxxxxxxxxxxxxxxxxxxxxxxxxxxxxxxxxxxxxxxxxxxxxxxxxxxxxxxxxxxxxxxxxxxxxxxxxxxxxxxxxxxxxxxxxxxxxxxxxxxxxxxxxxxxxxxxxxxxxxxxxxxxxxxxxxxxxxxxxxxxxxxxxxxxxxxxxxxxxxxxxxxxxxxxxxxxxxxxxxxxxxxxxxxxxxxxxxxxxxxxxxxxxxxxxxxxxxxxxxxxxxxxxxxxxxxxxxxxxxxxxxxxxxxxxxxxxxxxxxxxxxxxxxxxxxxxxxxxxxxxxxxxxxxxxxxxxxxxxxxxxxxxxxxxxxxxx HTTP/1.1
18:08:53.151070 IP6 mtu1280.master.test-ipv6.com > 2607:f598:b129:e600:fd1b:3cce:9223:4d22: ICMP6, packet too big, mtu 1280, length 1240

[...]
```

Out of curiosity, what is the contents of your `/proc/sys/net/ipv4/tcp_mtu_probing`?

**Comment by jfesler** [comment]
```
guest% uname -a
Linux guest 3.13.0-77-generic #121-Ubuntu SMP Wed Jan 20 10:50:42 UTC 2016 x86_64 x86_64 x86_64 GNU/Linux
guest% cat /etc/debian_version 
jessie/sid
guest% cat /etc/issue
Ubuntu 14.04.4 LTS \n \l

guest% cat /proc/sys/net/ipv4/tcp_mtu_probing
0
```

And when testing: 
```
guest% curl 'http://mtu1280.test-ipv6.com/ip/?size=1600&fill=xxxxxxxxxxxxxxxxxxxxxxxxxxxxxxxxxxxxxxxxxxxxxxxxxxxxxxxxxxxxxxxxxxxxxxxxxxxxxxxxxxxxxxxxxxxxxxxxxxxxxxxxxxxxxxxxxxxxxxxxxxxxxxxxxxxxxxxxxxxxxxxxxxxxxxxxxxxxxxxxxxxxxxxxxxxxxxxxxxxxxxxxxxxxxxxxxxxxxxxxxxxxxxxxxxxxxxxxxxxxxxxxxxxxxxxxxxxxxxxxxxxxxxxxxxxxxxxxxxxxxxxxxxxxxxxxxxxxxxxxxxxxxxxxxxxxxxxxxxxxxxxxxxxxxxxxxxxxxxxxxxxxxxxxxxxxxxxxxxxxxxxxxxxxxxxxxxxxxxxxxxxxxxxxxxxxxxxxxxxxxxxxxxxxxxxxxxxxxxxxxxxxxxxxxxxxxxxxxxxxxxxxxxxxxxxxxxxxxxxxxxxxxxxxxxxxxxxxxxxxxxxxxxxxxxxxxxxxxxxxxxxxxxxxxxxxxxxxxxxxxxxxxxxxxxxxxxxxxxxxxxxxxxxxxxxxxxxxxxxxxxxxxxxxxxxxxxxxxxxxxxxxxxxxxxxxxxxxxxxxxxxxxxxxxxxxxxxxxxxxxxxxxxxxxxxxxxxxxxxxxxxxxxxxxxxxxxxxxxxxxxxxxxxxxxxxxxxxxxxxxxxxxxxxxxxxxxxxxxxxxxxxxxxxxxxxxxxxxxxxxxxxxxxxxxxxxxxxxxxxxxxxxxxxxxxxxxxxxxxxxxxxxxxxxxxxxxxxxxxxxxxxxxxxxxxxxxxxxxxxxxxxxxxxxxxxxxxxxxxxxxxxxxxxxxxxxxxxxxxxxxxxxxxxxxxxxxxxxxxxxxxxxxxxxxxxxxxxxxxxxxxxxxxxxxxxxxxxxxxxxxxxxxxxxxxxxxxxxxxxxxxxxxxxxxxxxxxxxxxxxxxxxxxxxxxxxxxxxxxxxxxxxxxxxxxxxxxxxxxxxxxxxxxxxxxxxxxxxxxxxxxxxxxxxxxxxxxxxxxxxxxxxxxxxxxxxxxxxxxxxxxxxxxxxxxxxxxxxxxxxxxxxxxxxxxxxxxxxxxxxxxxxxxxxxxxxxxxxxxxxxxxxxxxxxxxxxxxxxxxxxxxxxxxxxxxxxxxxxxxxxxxxxxxxxxxxxxxxxxxxxxxxxxxxxxxxxxxxxxxxxxxxxxxxxxxxxxxxxxxxxxxxxxxxxxxxxxxxxxxxxxxxxxxxxxxxxxxxxxxxxxxxxxxxxxxxxxxxxxxxxxxxxxxxxxxxxxxxxxxxxxxxxxxxxxx'
callback({"ip":"2001:470:1:18::4:228","type":"ipv6","subtype":"","via":"","padding":"TG9yZW0gaXBzdW0gZG9sb3Igc2l0IGFtZXQsIGNvbnNlY3RldHVyIGFkaXBpc2NpbmcgZWxpdC4gQWxpcXVhbSBzb2RhbGVzIHVsdHJpY2llcyBlZ2VzdGFzLiBOdWxsYW0gYWNjdW1zYW4gdGluY2lkdW50IG1hc3NhLCBpZCB2ZXN0aWJ1bHVtIHB1cnVzIHNvZGFsZXMgY29uZ3VlLiBJbiBpZCBpYWN1bGlzIGF1Z3VlLiBEb25lYyBhdCBpcHN1bSBtYXNzYSwgcXVpcyBmcmluZ2lsbGEgYW50ZS4gTnVsbGFtIHJ1dHJ1bSwgZHVpIGZldWdpYXQgY29uZGltZW50dW0gbGFvcmVldCwgdXJuYSBhcmN1IHBvcnRhIGVzdCwgZXQgY29uZ3VlIHNhcGllbiBsZWN0dXMgcXVpcyBtYXVyaXMuIENyYXMgbmVjIHNlbSB2ZWxpdCwgdm9sdXRwYXQgbWF0dGlzIG1hc3NhLiBDcmFzIGZldWdpYXQgZHVpIHNjZWxlcmlzcXVlIGFudGUgYXVjdG9yIGF0IGZyaW5naWxsYSBzYXBpZW4gaGVuZHJlcml0LiBTZWQgaGVuZHJlcml0IG5pc2wgdml0YWUgbmlzaSBjb21tb2RvIGlkIGZhY2lsaXNpcyB1cm5hIGltcGVyZGlldC4gSW50ZWdlciBlc3QgZmVsaXMsIGxhY2luaWEgaWQgYWRpcGlzY2luZyBub24sIGVsZWlmZW5kIGlkIG5lcXVlLiBNYXVyaXMgZ3JhdmlkYSB2ZWxpdCBxdWlzIHNhcGllbiBzb2RhbGVzIGluIGlhY3VsaXMgZWxpdCBwbGFjZXJhdC4gUGhhc2VsbHVzIGhlbmRyZXJpdCBlcm9zIHJpc3VzLCBxdWlzIHVsdHJpY2llcyBsYWN1cy4gUXVpc3F1ZSBmYWNpbGlzaXMgYWxpcXVhbSBhdWd1ZSB2aXRhZSB2b2x1dHBhdC4gTmFtIHNpdCBhbWV0IGxvcmVtIGluIGxhY3VzIHBoYXJldHJhIHRlbXBvciBzZWQgZWdldCBudWxsYS4gTnVuYyBsb2JvcnRpcyB0aW5jaWR1bnQgbmlzbCBldSBldWlzbW9kLiBJbiBoYWMgaGFiaXRhc3NlIHBsYXRlYSBkaWN0dW1zdC4KCk51bGxhbSBuZWMgZW5pbSBhYyBwdXJ1cyBvcm5hcmUgc2NlbGVyaXNxdWUgZWdldCBzaXQgYW1ldCBzZW0uIERvbmVjIG1vbGxpcyBqdXN0byB2ZWwgbnVuYyBkaWN0dW0gY3Vyc3VzLiBDdXJhYml0dXIgdml2ZXJyYSBwb3N1ZXJlIGNvbnZhbGxpcy4gVmVzdGlidWx1bSB2dWxwdXRhdGUgc2FnaXR0aXMgc3VzY2lwaXQuIFF1aXNxdWUgdmVsIG51bmMgYSBzZW0gdm9sdXRwYXQgcG9ydGEuIEludGVnZXIgaW4gbWkgZWdldCBhbnRlIGx1Y3R"})
guest% 
```

I get this:


```
guest% sudo tcpdump -r 111.bin -n host mtu1280.test-ipv6.com 
reading from file 111.bin, link-type EN10MB (Ethernet)
18:11:09.672241 IP6 2001:470:1:18::1280 > 2001:470:1:18::4:228: ICMP6, neighbor advertisement, tgt is 2001:470:1:18::1280, length 32
18:11:09.672269 IP6 2001:470:1:18::4:228.51133 > 2001:470:1:18::1280.80: Flags [S], seq 467363271, win 28800, options [mss 1440,sackOK,TS val 923335431 ecr 0,nop,wscale 7], length 0
18:11:09.672668 IP6 2001:470:1:18::1280.80 > 2001:470:1:18::4:228.51133: Flags [S.], seq 3119740951, ack 467363272, win 28560, options [mss 1440,sackOK,TS val 147880482 ecr 923335431,nop,wscale 7], length 0
18:11:09.672730 IP6 2001:470:1:18::4:228.51133 > 2001:470:1:18::1280.80: Flags [.], ack 1, win 225, options [nop,nop,TS val 923335432 ecr 147880482], length 0
18:11:09.673250 IP6 2001:470:1:18::4:228.51133 > 2001:470:1:18::1280.80: Flags [P.], seq 1:1377, ack 1, win 225, options [nop,nop,TS val 923335432 ecr 147880482], length 1376
18:11:09.673925 IP6 2001:470:1:18::1280 > 2001:470:1:18::4:228: ICMP6, packet too big, mtu 1280, length 1240
18:11:09.673984 IP6 2001:470:1:18::4:228.51133 > 2001:470:1:18::1280.80: Flags [.], seq 1:1209, ack 1, win 225, options [nop,nop,TS val 923335432 ecr 147880482], length 1208
18:11:09.674004 IP6 2001:470:1:18::4:228.51133 > 2001:470:1:18::1280.80: Flags [P.], seq 1209:1377, ack 1, win 225, options [nop,nop,TS val 923335432 ecr 147880482], length 168
18:11:09.674238 IP6 2001:470:1:18::1280.80 > 2001:470:1:18::4:228.51133: Flags [.], ack 1209, win 246, options [nop,nop,TS val 147880482 ecr 923335432], length 0
18:11:09.674263 IP6 2001:470:1:18::1280.80 > 2001:470:1:18::4:228.51133: Flags [.], ack 1377, win 265, options [nop,nop,TS val 147880482 ecr 923335432], length 0
18:11:09.675258 IP6 2001:470:1:18::1280.80 > 2001:470:1:18::4:228.51133: Flags [.], seq 1:1429, ack 1377, win 265, options [nop,nop,TS val 147880482 ecr 923335432], length 1428
18:11:09.675303 IP6 2001:470:1:18::4:228.51133 > 2001:470:1:18::1280.80: Flags [.], ack 1429, win 248, options [nop,nop,TS val 923335432 ecr 147880482], length 0
18:11:09.675325 IP6 2001:470:1:18::1280.80 > 2001:470:1:18::4:228.51133: Flags [P.], seq 1429:1893, ack 1377, win 265, options [nop,nop,TS val 147880482 ecr 923335432], length 464
18:11:09.675338 IP6 2001:470:1:18::4:228.51133 > 2001:470:1:18::1280.80: Flags [.], ack 1893, win 270, options [nop,nop,TS val 923335432 ecr 147880482], length 0
18:11:09.675349 IP6 2001:470:1:18::1280.80 > 2001:470:1:18::4:228.51133: Flags [F.], seq 1893, ack 1377, win 265, options [nop,nop,TS val 147880482 ecr 923335432], length 0
18:11:09.676238 IP6 2001:470:1:18::4:228.51133 > 2001:470:1:18::1280.80: Flags [F.], seq 1377, ack 1894, win 270, options [nop,nop,TS val 923335433 ecr 147880482], length 0
18:11:09.676396 IP6 2001:470:1:18::1280.80 > 2001:470:1:18::4:228.51133: Flags [.], ack 1378, win 265, options [nop,nop,TS val 147880483 ecr 923335433], length 0
guest% 
```

**Comment by jfesler** [comment]
What you enabled .. is a workaround for PMTUD not working.  I've actually not seen this on Linux - I guess I learned something new today.  I *do* see this behavior on Windows, out of the box; but nowhere else.  Microsoft I guess doesn't want to deal with support calls over poor choices in ICMP filtering.

**Comment by jfesler** [comment]
I'm actually baffled as to why your system clearly received the Packet Too Big message - and clearly *did not* fragment the tcp packet (at either L4 or L7).    Looking at my own tcpdump..  the packet was fragmented at layer 7 and resent.

**Comment by univerio** [comment]
I think you're right. I tested the same machine on a different network and it was working. I'll try to do some more digging.

In your experience, have you seen that behavior with OS X?

**Comment by jfesler** [comment]
I have only seen Windows (by default) do black hole discovery. 
The IPv6 MTU test my site runs mostly hits Linux, Android, BSD, and Mac OS X.

**Comment by univerio** [comment]
Hm. I ran wireshark on Windows. It seems to respond appropriately to Packet Too Big messages. It doesn't appear to retry a bunch of different packet sizes. I also tried disabling [black hole detection](https://technet.microsoft.com/en-us/library/cc960465.aspx) and it still worked fine.

I've posted a question [here](http://serverfault.com/questions/767433) in the hope of somebody being able to answer this.

**Comment by jfesler** [comment]
Windows does black hole detection only if TCP stalls. If it receives Packet
Too Big, it does not have try black hole detection.




-- 
 Jason Fesler, email/jabber <jfesler@gigo.com> resume: http://jfesler.com
 "Give a man fire, and he'll be warm for a day;
 set a man on fire, and he'll be warm for the rest of his life."

**Comment by univerio** [comment]
I've figured out the issue. This is caused by TCP sequence number randomization. The kernel was apparently unable to figure out which TCP connection the Packet Too Big message was referring to so it couldn't retry with the correct MTU. Disabling TCP sequence number randomization fixed the issue.

This perhaps should go into the FAQs.

Thanks for your help.

**Comment by univerio** [comment]
Yeah, sorry, I should have clarified that it was due to the interaction between TCP sequence number randomization **in my firewall** with the retransmission logic in Linux, so probably not much you can fix on your end other than putting a message in the FAQs like "oh if you have a firewall it might be rewriting TCP sequence numbers which breaks PMTUD."

Without digging into it deeper, here's my hypothesis.

- The firewall rewrites the TCP sequence numbers from my OS.
- The remote server sends back an ICMPv6 Packet Too Big message containing the modified TCP packet.
- The firewall does not rewrite the TCP sequence number contained in the truncated TCP packet inside the Packet Too Big message.
- The Linux kernel doesn't know what to with the Packet Too Big message, so it retransmits the TCP packet using the same MTU.
- This repeats ad infinitum.

The same thing works on Windows presumably because the Windows TCP/IP stack doesn't rely on the sequence number to know that it should use a smaller MTU for that particular connection.

Would you still like me to give you details about my setup?

**Comment by jfesler** [comment]
Hard to say if Windows ignores the sequence number; or just uses aggressive black hole detection.  I do know the detection *is* quite aggressive - most people don't notice MTU issues with Windows.

If you'd be kind enough to share what you did, I'll figure out how to word it.

It would be *appreciated* if you let your firewall vendor know they have a bug that breaks PMTUD.  Hopefully this is a real firewall product (and not a mass market consumer device); hopefully a product with a staff that will take the report seriously. I know with CPE vendors.. this is pretty much impossible through the front door.

If you're willing to share firewall details privately (jfesler@test-ipv6.com) I can see if I happen to know of any contacts, or know anyone who in turn has such contacts.  If there is a bug filed, that person can help make sure the bug is given attention.  Please let me know if I can share your contact info; if you have a ticket number/bug number; or if you prefer to stay anonymous. 

Thank you for sharing!

**Comment by univerio** [comment]
I'll try to document the symptoms, the diagnosis, as well as the final fix. Let me know if you need me to expand on something. Feel free to include my contact information. I have not filed a ticket with the vendor.

Symptoms
=========

TCP connections appear to time out when sending packets above the size of the PMTU (indicating broken PMTU discovery), but ICMPv6 packets are configured to be allowed through the firewall. Investigation with Wireshark yields the following:

![image](https://cloud.githubusercontent.com/assets/1037172/14216958/65f7b9d6-f800-11e5-8349-e8ad8f30e441.png)

This seems to indicate that the ICMPv6 messages are being received but not honored.

Diagnosis
=========

Comparing the binary packets I observed a difference between the TCP packet sent and the ICMPv6 received, which is supposed to contain a truncated version of the original TCP packet:

![image](https://cloud.githubusercontent.com/assets/1037172/14217189/70d4983c-f801-11e5-86a1-94618ced7f18.png)

The sequence number in the TCP packet inside the ICMPv6 message is different from the one that my OS sends out. This indicates that the firewall's TCP sequence number randomization is interfering with PMTUD.

Solution
========

I tried disabling TCP sequence number randomization in my firewall:

![image](https://cloud.githubusercontent.com/assets/1037172/14217394/966abb0c-f802-11e5-8ec6-e8622d108321.png)

And every started working:

![image](https://cloud.githubusercontent.com/assets/1037172/14217434/d6eccf08-f802-11e5-8d19-aa99f2265e82.png)

Additional Details
==================

- OS: Ubuntu 15.10 4.2.0-27-generic
- Firewall: SonicWALL NSA 220, 5.9.1.0-22o

**Comment by jfesler** [comment]
From a friend of a friend:

> Hey guys, this needs to go through support to get the SEEG oversight it needs. If you send me the case number I can ensure that it doesn't get overlooked or closed by a level I tech.

**Comment by univerio** [comment]
Thanks for the follow up. Unfortunately Dell requires a support contract to even submit a bug report like this, which we do not currently have. =/ I'll see what I can do, but spending $200 just to submit a bug report is a little difficult to justify.

**Comment by jfesler** [comment]
I see.  There is little I can do to guarantee it gets any attention without being a customer. I've asked folks to forward this on via back channel but it may not get the attention it needs.

I'm not going to update the faq page for this.  If anyone else does run into this with sonic wall ill refer them to this issue for guidance; and hopefully they have a support xo tract to file a big with.

**Comment by jfesler** [comment]
From one other back channel:
>"Known issue and fixed (resolved: not critical), not in the official builds yet, hotfix available if necessary but available through support channels."

**Comment by univerio** [comment]
Ah, that makes me feel better. I wish they had some sort of public bug tracking system so I would have been able to Google the solution instead of spending a day investigating it myself.

Again, appreciate all your help! The future of the Internet thanks you.
